qid,question_text,target
0019adaf81e8c9b5d0a9,Is it normal to lose your mucus plug during an early pregnancy?,0
0019b9123a19daca2107,What is the value of Sin^2A+sin^2B?,0
0019bf4e4c6ab6ddc350,What do the Dutch think of the Roosevelts?,0
0019c5ad15ffbcf618df,"Have you ever met or befriended a woman who has enough physical strength and is ready psychologically to overpower, tie up and gag an average man in case of being that necessary for her safety?",0
0019c7f5b9264aaae120,What software would you recomend in order to find the posts with the most likes on a Facebook group or page?,0
0019e01b2a7b09d3cb65,Why are South Indian dishes which are prepared by North Indians more tasty than dishes prepared by South Indian restaurants?,1
001a1aca131403debe46,"How much employment does a super yacht represent? How many people are employed and for how long, in sourcing the materials & then building the vessel?",0
001a1f52fc3bde74369b,Which private college is good in WBJEE?,0
001a2b7a4b30db631573,How can I change my last name in California?,0
001a2f88f7748c322831,"What are some practical and possible applications of machine learning in life sciences, ecology, conservation biology, and environmental sciences?",0
001a44b54f34ecb40407,How do you load a black powder rifle?,0
001a4e6d27e6e0d13d53,Should you be able to name specific companies you have introduced to opportunities if no transaction has resulted?,0
001a5b31ecfa71a5a8b2,What is a fiduciary? How is it different from a financial advisor?,0
001a707ca50b058de43b,How can we build self-confidence in Women?,0
001a79064eab17873465,Why do American firms steal Chinese technology?,1
001a9a02f515814d3493,What proves I was born from another human being? I don’t remember being born.,0
001ad6eb5e54caafb002,Can I get MBBS seat in govt medical colege in Gujarat if my state ramk is 641?,0
001ad8b387372b905f6b,Getting a -000 reading from white wire that's tied to the ground bar what does that mean?,0
001add8ec6a6a849e3c9,How long do you think it will take for Quora to remove this question? Closest guess wins a prize.,0
001ae003f36e9436dea3,Where can I purches some DMT in Orange County?,0
001ae2a5d5eebca9dd80,What is the recipe for boiled egg noodles?,0
001ae3890b72b4aeb079,Is paddy a herb?,0
001af72a0bd3e0365665,Do therapists actually care about you like they would a friend or do they care cause it’s their job?,0
001b09db7006fcd8f809,What does it mean if I have a light sensitivity and sometimes my head is in pain and it I feel that it will broke into half?,0
001b0c34a25a7d67cfed,Can I get CSE branch in VIT Chennai if my rank is 28777?,0
001b0e88771dc7995918,Is it legal for a debtor or quit their job to avoid a creditors collection efforts and still claim unemployment in California?,0
001b122adb7d419c5cef,Among all which software service based companies have higher salary?,0
001b1a614d11f9d8d4de,How long would it take for someone to notice if you suddenly disappeared?,0
001b2c881f7214066999,How social networking sites work with opinion mining techniques applied on user comments?,0
001b397cebd9cfe722c7,Are you doing your dream job?,0
001b3c2ff060eee74cba,Why is Jinping the biggest serial religion murderer and rapist leader of the world after Mao?,1
001b436e0fc39672e0c6,How is ammonium bicarbonate used in production of bread?,0
001b4a22ba7778f9c799,Are Jat and Gujjar girls beautiful?,1
001b5f380d62f65ff3ad,Does a box of ammo just explode or does each individual bullet go off like fireworks?,0
001b7ab0d26dbf550b68,What is the best method for determining what your values are?,0
001b8093b284ae1919b7,What is the difference between impression materials and impression compound?,0
001b83155921c51dbeba,Is someone from SCI Graduate Marine engineers (GME) Mumbai?,0
001b981150645928d056,How do animals defend themselves out in the wild?,0
001ba1117b392b96f371,How do I get a job as an ilustrator?,0
001ba14913e56f9657bf,Can California legally require that Tinder stop charging users over 30 years old a higher rate?,0
001bac959ac390848245,"What is the book ""Nothing Succeeds Like Success"" about?",0
001bc4c694738bdd775c,What cold war and its effects?,0
001bcb41db4b1b2ddffb,Why has polythene been banned in our state and country?,0
001bceea34c76d8530d2,Do State Bureaus of Investigation investigate homicide more than the FBI does?,0
001bde3a341075622612,How religious are Tunisians?,0
001be7e35e12f0e69666,"Is it difficult for animal welfare charities to compete against those that benefit humans, epecially when many of us have limited funds to contribute?",0
001bfc5dcf55dc2e655b,Why should you consider taking a train ride from Philadelphia to Baltimore?,0
001c0ebb687d054b01e8,What are Howie Seago's major accomplishments as an actor?,0
001c2f7108f15df7c4f7,What are the risks of bleeding and clotting during early pregnancy?,0
001c3184df991f0114ea,Do animals make noise when having sex?,0
001c40e6ce41d6525e9e,How is it that I can get 6 to 8 hours of sleep before my graveyard shift and still have trouble staying awake for my 7 hours of work?,0
001c444263b3e2bc21b3,What is considered a babyface in WWE?,0
001c473467659b27a143,What are the new topics for research in Human Resource management?,0
001c496c456789c2c952,What are the challenges that Lori Anne Allison has faced as a makeup artist?,0
001c49b41ddfc6df2687,What are some of the most remote areas in the world?,0
001c5124892b192bd07a,Where can one apply for aadhar in bandhup West lbs Marg?,0
001c52bfdf0c2531ba0c,What are objective criteria in evaluating cell's health in culture?,0
001c563eb2f901ccfe1e,What is the salary range of the salary of rich people?,0
001c5a0779025ff57b23,What happens to those who have less than 75% attendance?,0
001c5b40d4a0ab08afe2,"Who is the worst USA president, Bush or Trump?",0
001c5b990bfe99882b87,I have corrected only my exam centre in NEET form do I have to pay any correction fee?,0
001c6650cd1941bf76bc,Do you know about Mumbai call girl service?,0
001c7da69d094a1c40c9,What is the full procedure of cutoff based admission in Delhi University?,0
001c803fb675ae7ec0ed,"What is the longest practical distance that light rays could converge? (on earth, in a standard atmosphere)",0
001c81d39605a7114130,"Why did Captain Phasma give up so easily? I, personally thought that she was going to somehow resist or trick the gang.",0
001c92773afd4fa4f519,What is scope of BA?,0
001c9458075a77efbb20,Why there is lots of suicide?,0
001c9a36430d12f0d4a4,Is it racism what this Australian girl did to me? I'm Asian.,0
001ca58d3f1a109e929f,What do you think about the protests against Padmaavat (Padmavati)?,0
001cae42ecabdac9f4d7,How did we decide that the earth rotates from west to east?,0
001cae85b942c3f9147c,How can I be a great footballer?,0
001cb908f1862e4d0e17,What is the diff between LTE and volte phone in providing facility?,0
001cbffb94301fb31970,Prevent forwarding of your WhatsApp videos?,0
001cd2f944e9c9bad411,What songs should we play during the cocktail hour at our wedding?,0
001cd5e0fbde21f51114,How common is injury due to friendly fire in military operations?,0
001cd9158c7643ba6ec4,Where can I find a free carpet installation invoice template?,0
001cdfc8399334492e7e,"Why do people on Quora not answer my question about gun control? I just want to debate with people who support gun control, but no one answers it.",1
001ce08c98ec582f76c4,Why do I always mess everything up?,0
001ceedd9fd5145f89bf,"When will the US stop supporting Kosovo terrorists (Albanians), who are actually the same as ISIS?",1
001cfc962e236e2f39ad,What 1890s born celebrities were still alive in the 1990s?,0
001d2185838a0729276d,How do sex workers handle and secure their cash earnings?,0
001d270a06cc4b88bfa5,"I have made payment for AA recruitment fee but transaction didn't complete and balance deducted from my bank account and the site is still asking for payment, why so?",0
001d359052c29542d033,I've got 88/200 in MU OET 2018. What branch and rank can I expect?,0
001d483f2ccf2acb0124,Has it become more difficult since 2015 to land a job through the USC MS CS program?,0
001d4b1c09a2fd827c73,What should Indian teenager never try in there life?,0
001d62c04f615ac18171,Is the job market bad for experience holders in India currently?,0
001d7d896eff993e13ff,Would a famous person on social media ask a fan for something like money or iTunes cards?,0
001d81082a5d56053f66,What are Robin Gibb's major accomplishments as a singer?,0
001d874ba189c5e5e43e,Why do Americans need the second amendment? Don't want to start a fight but the right says it is necessary for a democracy and such and why are they so worried about the government.,1
001d8c11e13e34ed537e,What is the budget for new year camping in Jaisalmer?,0
001da585fa112f5c858d,What are the best humour or jokes in the world?,0
001da5913d2e9a57acfa,"What role did Leigh Francis develop as the fictional character ""Keith Lemon""?",0
001da7d54bc8e203c953,Will cars be still around in 100 years?,0
001da927ea21866d311a,Is it true that Chennai is developed because of Telugu people?,0
001db5b7ff986ad7a848,Is it dangerous to have blood in cough in morning?,0
001dbee90b80b316b69b,Why would more people live in one country over another?,0
001df1d605dfda8d83c4,Is Mack 10 blood?,0
001dfa447fc7832fa734,Whatis the difference between a stag and a buck?,0
001e00614ea57296097e,Can I lose weight without eating eggs?,0
001e2cd5ea2976993f8d,Can a restaurant play loud music in?,0
001e353999aef43beb60,What are some cultural taboos in Russia?,0
001e3a56ee27928c1408,"What if I want to start practice after articleship in big 4? If not practice, what are other options available?",0
001e3dd3cd24e70c88c4,What does Europeans think of anti semites attacks by Muslims in their countries?,0
001e49b0dc276f1bb704,How did James Burke become deaf?,0
001e560f0e81317d3da3,Is there any directory for IT professionals in Bangalore?,0
001e564620cebac45a2b,Is it possible to suffer from depression without knowing it?,0
001e5c14dd1a8f9f689e,How can I disassemble .22 double-action revolvers?,0
001e5fa00879db157080,Will you be able to play a co-op games between a Nintendo 3DS and the Nintendo Switch?,0
001e6d407eff16917db7,Why is it hard to download games from the Play Store?,0
001e81182bb42f3f5a24,How do I get cheap flight tickets from Delhi to London?,0
001e934a86900712c024,How can I quickly learn breakdance power moves?,0
001e98bd44cf1984922c,Is there a stereotype attached to people from Sydney’s northern beaches?,0
001ea01df07c548cce9f,Do you think inflation hits rich businessman?,0
001ea2fa120a9a772e07,Can you make more money as an electrician?,0
001eb5a39fa0a3dea419,Why Indian girls have fetish for White guys?,0
001eb75a7cef68f4e75d,"What are some tips to write a summary about ""Until they bring the streetcars back""?",0
001ec413aa3f4a2f579b,Who is the best broker for a new real estate agent in California?,0
001eca5555b70ab163e0,Whats the cleanshot way to express ones feelings to a girl irrespective of the outcome?,0
001eea1cb132908a9067,What are your views on Barkha Dutt switching to NewsX?,0
001ef1285da71edd27ba,Would Twitter hire you if you don't have a Twitter account?,0
001ef2c4d31b3789e104,"How was Swagatham 2018 program by CSA, IISc for GATE 2018 toppers? How people are selected/invited and do they invite only Computer science students or others also?",0
001ef6c475dba489139a,"I get 1st place or otherwise in the top three for hashtags on nearly all of my posts, even with million-post hashtags. However I do not get much traffic from that, only getting follows through following. What am I doing wrong?",0
001f04f8c6c3af508aa2,How can I get market research report on kids apparel industry India?,0
001f075cf2e3201b735f,What are the different types of consultants and what is the qualification to become a consultant?,0
001f1524e85e4eff58aa,What's your favourite?,0
001f22f11492d8763c79,What is the difference in listed and unlisted company?,0
001f28548d64873b98bc,Should I ask any questions?,0
001f30d73ed1a9264511,Which are the best books to read for Indian politics and which tells truth about all the political matter?,0
001f382de00d94877c2c,Does an analog energy meter rotate when the load is off?,0
001f38a9665551cbfc0c,What will people know about Generation Z in 2050?,0
001f4234bd89ec5f8903,Could the modern Canadian military take on Nazi Germany of WW2?,0
001f456432715e83b43f,"If I throw an ice cube into the ocean, what is the chance that I will come in contact with one of those water molecules (from the ice) again in my lifetime?",0
001f4bf62a9347cd2d3d,"Why my Acer Aspire V 13 laptop show me ""no battery is detected""?",0
001f4f3f272816d6bc39,How can I forcibly convert all Chinese people to Sunni Wahabbi Islam?,0
001f54da2c943aa1737d,Can I get a friend from UK or USA?,0
001f5739f5fd67ad262c,What are the requirements to get in Princeton?,0
001f77ebfc529acb9ed1,How are the two types of urban local bodies constituted?,0
001f9180b6616782595f,Did the idea of yin and yang originate in China?,0
001f952e00ecf5d82544,What should you take into consideration when making a Hank Hill costume?,0
001fabd80ba520fe8fe1,Can a Chinese person start a political party?,0
001fbe4a683582df8a47,Why iron is not found in its free state?,0
001fc3a1da8e0508e8f8,How fast will humans die If the sun suddenly turn off and solidify maintaining the same gravitational force?,0
001fc4667f851fac177e,How do you search for and find mass graves?,0
001fca1b841245bf4e7b,Do crime reporters face death threats?,0
001fdc32baad36e6892e,Which is the best elevator company in India?,0
001fe721341ce146c645,Will the end of Net Neutrality help traditional media rebound?,0
001ff239535a9d75271a,Is there any apps for mining bitcoin with paid version?,0
001fff421a1f26881c23,Who was the shortest professional wrestler ever?,0
002000ee4afd7a5f1efd,Which offices or agencies are legally able to arrest a sitting U.S. President?,0
00201293fd3be3499dd3,Who are the major jute exporters in Bangladesh?,0
00201a282665c6dfad0f,Which university should I apply for a bachelor in the liberal arts in Europe?,0
00201b7c10e2b1684ec4,"TUM Masters in communication requires recommender to state that the candidate was in top 20%, why will he do when he wasn't?",0
002022401f088ae5a0f3,"My body temperature has increased slightly, but I don't have any feverish feeling. Is there any matter of concern?",0
002024c88aa44056256c,What summer internships are available for marketing aspirants?,0
00202e4e4fb8c2b3aca3,What are the differences between depression and melancholia?,0
0020422bfcdfa73d2bf7,How did you manage to overcome childhood adversity to become the person you are today? What were the prime motivators during your journey?,0
002047be63273f2d2e78,What is the genetic background in details?,0
002057863c6405e096f9,"If men have a better pain tolerance than women, does that mean they would handle childbirth, menstrual pain and breastfeeding better?",0
00208054da1eb27f53de,What was the historical significance of Mesopotamia's god?,0
0020853e782d27d173fc,Why is it ironic about the meaning of salem where so many people were hanged in the crucible?,0
00208e4f9fad2f1cf9f9,Is it wrong that I love someone I've never met?,0
0020938347b83674aa21,Is there anything called love at first sight?,0
0020a9d9c2f28556a538,Do Akshay Thakre has naag-mani with him?,0
0020c0d48fc14370110e,"This guy tells everyone that he hates me, but I have never talked to this guy. If he does why does he keep staring at me and try to look at me when I’m not looking?",0
0020d78c6e28b90acd41,Where is the answer key of mock test for AIIMS 2018 which is distributed tomorrow?,0
0020e40d0df413e82faf,Why some LG phone tempature get too high?,0
002108331ca718da9728,Can teachers smack students at school in Australia?,0
00210ce013634bc7b445,Why is Aerogel so expensive?,0
002115139b023d1c4580,"Is it ok to walk your dog in the rain, or what are alternatives?",0
00211f86764762d50cca,"What is the plural of ""Mathematics""?",0
0021228d6607e74de36b,"Why do people act like having sex is this amazing thing and everybody else should want to have it? I don't care if people enjoy sex if they're happy, but I hate when they act like my asexuality means I'm either missing out on life or being childish.",0
002156afeba2b96efdfe,How much does it cost to live in Paris for a month?,0
0021827406e229e753d1,"How can I say (and write) ""Are you Tibetan?"" in Tibetan?",0
002187f1616a7e34e5e5,How do you change the wording in a Groupon review that I already submitted?,0
0021892805a645de2363,"If Jorge Luis Borges was alive now, where would he publish his short stories?",0
0021a2392cf121a39298,How do you make sure you are implementing the ideas you get from the books you read?,0
0021b5c11d010546bb44,What is the point of intersection between y= \sqrt {6-x} and y=x?,0
0021c01ad85c33c2434e,What is the best way to report fraud by a hospital or medical practice?,0
0021c28129e9855577ef,Why do people on YouTube disrespect my opinions with fake exhausts on cars such as Mercedes-Benz and Audi?,0
0021d2565fefbc58f2e7,"Do you shower before breakfast, or have breakfast before showering?",0
0021dbf7b024da4c7b3d,"Given a constant volume, does pressure drop as gas is absorbed?",0
0021fcc5bc562f44adcb,What is the name of the bird that lives in gir forest and freezes when threatened?,0
0022053464a8c2cb356a,Is it possible knowingly to stop your own heart or heartbeat?,0
00220a95d2704c34b829,"Doctor injected anesthetic into my skin for minor surgery. I felt a cold rush through my body, but absolutely no numbing in the area whatsoever, I felt it all and it was horrible. Could he have injected directly into my bloodstream?",0
00220e19600c39b443f4,What is cryptorchidism and how is it treated?,0
00220ff216f041d0ab26,Why is education better than business?,0
00221a47834dfe7966d1,Should I really feel that it's okay not to love or respect women?,1
00222221e617b0369baf,Is there a way to switch accounts you signed up with on your Windows 10 PC?,0
00222e960cd49d9986f5,Why did most of the colonial empires come out of European countries?,0
002237699bdd476961d3,"You can swap your identity with anyone in the world but you are stuck with their body, money, house, debts and family forever, who do you choose?",0
0022382dfadbec7105c0,Does buying a graphic card holding laptop damage the laptop's performance faster than that of a ordinary laptop?,0
002245795c50f2043fe5,"What is the Orthodox Christian argument against ""Filioque?""",0
002257f1d944f9ba88b7,How do you know when your boyfriend is bipolar?,0
00225af4343a25be325f,"Economically speaking, were wages higher for men before women entered the workforce?",0
0022818e762ead1984a8,Is the X1 Bike waterproof?,0
00228419dc50c44eb844,What are the most resent challenges in human resources management that need to be addressed?,0
002284840b558e065b03,"What are those kid gang genre movies like The Goonies, E.T or Stand By Me called?",0
002284dd90794d81879c,What are some examples of fables and folktales?,0
0022b04d8437d2898d75,Why is Snapchat popularity declining?,0
0022b0ea865d8c394eb2,What does the chairman of a regional federal reserve do?,0
0022b387a151c3146501,Is Canada a better country to pursue MBA in banking and finance after 2 years of experience in Indian banking system?,0
0022b3b60a6b252f6fd3,What is the colour of methyl orange in limewater?,0
0022bcbe25f17b84b114,What causes itchiness in my breasts?,0
0022c5ac39c249938981,"Can comrades of Quora answer, who are the IAS, IPS. IFS, IES officers that suffer due to their mentally retarded children?",1
0022f66fdbb921993232,"If every other car is autonomous and you had the only non-autonomous car, what would you do?",0
0022fa0c1e4cf381e6f9,How can I start earning after doing my MBBS other than private clinics? Like how to apply for hospitals and what would be the salary?,0
0022fb1bd42f9da06890,What is the best collection of amazing facts?,0
00230872a2becd4b4772,Which are some of the world's most dangerous for activists?,0
002309c07cc9959e6f32,Is it bad for a 13 year old girl to be extremely close to a 22 year old girl if they're not related?,0
00231f314f664aecc302,How can I train a Yorkie-Pom dog to follow my commands?,0
00232e88579f3e067d5e,What are the best running shoes for flat feet?,0
002335c41c0235476322,What is the easiest way to convert cubic feet into liters in basic chemistry?,0
00233c4e4d379154763c,Are there any uses of sports certificates at school level in any interview?,0
00235253bf6d200affc4,How many times has the U.S. Air Force failed to send over court martial records to the F.B.I.?,0
00235520fbc0099e509c,What should I do if I’m electrical engineer but very intrested in mechanical machines & equipments?,0
002357cfc3218a7f9005,What is future of Administrator in Linux?,0
002362eb57ac3c962f96,why do Gopal Krishna Gokhale was considered an important mentor to Gandhi?,0
002370c4314caeb642ea,Where can I buy unique and quirky products online?,0
00237878d85935ef715d,"Game of Thrones, what does Arya find out about Littlefinger?",0
00238b87eeb29a9d84a6,What are some of the foods which should be taken at least once in a week?,0
00239fe97666cfc4c834,What's the weight of undergraduate research while applying for Integrated PhD (Physics) in India? Does not having a research paper published after Bachelor degree deter the chances of getting selected?,0
0023a4abbfdadb9c7ca3,"M.Planning or M.Des, whats better after B.tech in civil engineering?",0
0023b7f5f1c80171363c,What are some of your 'Bakkushan' moments?,0
0023e8fc9d36a1a1d692,Does walmartlabs give new hire stock grants and how does the RSU vesting work?,0
0023ef31653c30d9bcb2,What do you think will happen to Bitcoin 2018?,0
0023f61054eb59e816cb,What is actually happening in Syria with children?,0
002409e1ac34d209f6dc,"If Hispanics are so proud of their countries, why do they move out?",1
00240b36ddeeaba73487,What are the job prospects after doing an MSc in Chemistry or Biology?,0
002422f6f10c9b7c6dc0,What would you name a cognitive automation solution?,0
002428bbab7c0d60962c,Does Facebook record audio on users' devices for ad-targeting purposes?,0
0024296ad0dfc438c6ce,How is pre-ordering considered bad?,0
0024309fbe3a68a0c1e0,Which college I could get with 530 marks in neet'17 specially in UP?,0
00244c27242395f078f4,What is the point of speed limits on interstate highways and nonresidential/city roads? Stationing police officers on these roads seems like a huge waste of limited police resources.,0
00244c40cb3801ef15f5,What are some good tips for ESO?,0
002472cd3175b0abeaf1,Which dog collars are the best to use when training dogs?,0
002478730f724cd42813,Why does Quora have a text limit?,0
0024839018cb7fc74f36,What is the easiest way to get rid of debt?,0
0024a74f79954483a52a,How does the multiple-hit hypothesis explain the development of cancer?,0
0024a7a2b847062cb1e2,What happened in the year 0?,0
0024a9c12525ffeb0230,How do are non-dihydropyridine calcium channel blockers used?,0
0024b4e5fbf310a1872e,How can I cope with my boyfriend being extremely jealous?,0
0024b8399bcf259e6950,A governmental organisation is threatening your life. You have five hours to hide. What do you do?,0
0024ba548e3e3b41654f,What does car mean?,0
0024beb5bbb4b0d7af9d,Do you have a particular kind of music that you listen to when you are sad?,0
0024c55a4de24768af7e,Can I give a reward to my virtual assistants for their efforts?,0
0024eeeeb6f42f9f90f8,What are the admission requirements in Stanford university for an Indian student?,0
002526149557c2184b12,What are some sites on the web that criticise indie films?,0
00252aa6b68b87b6ac0c,Which type of questions may asked to a civil engineer in UPSC civil services interview?,0
002548d626f2cfb447ec,"Are the U.S, sanctions against Iran legal and in good faith?",0
0025533674d2c471b892,What do you think will happen in Seasons 5 and 6 of The Americans?,0
002568bb0c1beea277be,Why do people think it is okay to ask people online advice about health issues?,0
002586ec0b7b51ab4e30,What are some signs that indicate Trump is trying to turn the United States into an authoritarian state?,0
00259bcae404abf62841,What are the harsh truths about Africa?,0
0025a1fd60219911a60c,How is your experience with husky dogs in India? Can they sustain Indian tropical environment?,0
0025a2d865e3c26f97f8,What are the prerequisites to become an assistant professor?,0
0025b2f65c150dce2123,Is it helpful to do mtech with low aggregate in mechanical engineering?,0
0025b4830ca6cfe7e866,"Do you, as a Christian, think that Jews should convert to Christianity in order to be saved?",0
0025c4f839334aae978b,Did Augustus get married?,0
0025e7f20204c98ef838,Are there any theories about how human memory is stored other than in synapses?,0
00260725bbeec41eaea7,Who is paying for the royal family besides the Brits?,1
002624a1a6d19eea5a65,Is queen Elizabeth related to king henry viii?,0
0026284a957ec05a58f0,Why are drain flies common on sewage systems?,0
00262fb9282b3935b46a,How long does it take you to process a cow?,0
00263f2cf793055ea939,How do charities become so huge?,0
00264140abc999bd4be7,"Why are Europeans so ungrateful for America? They'd be speaking German without us and because we cover their military costs, they can spend more on social safety programs.",1
00264a7963de2407fc96,Where do I find the class clowns at Harvard?,0
00264b2bbed6cc8df1f2,Is there a future for us?,0
0026566af1ec7749f8aa,Which city in India has a good ecosystem for developing prototypes real fast and real cheap for inventors?,0
00266719cffa5b43eec7,Is it worth to study in MBA in tier 3 colleges like TAPMI / BIM / KJ SOMAIYA?,0
00267690d6ed59b003e2,What is the lease agreement for Common.com or Ollie.co or Coliving.com?,0
00267daf7881acc08c4d,"Do companies like TCS, Wipro, Infosys give salary during their training period?",0
00267ec73dcc3d626779,What supplements work for growing boobs?,0
0026987cc06fdc85d600,Should we be more concerned with whether Carter Page is a Russian spy and why was he working for the Trump campaign?,0
