qid,question_text,target
00002165364db923c7e6,How did Quebec nationalists see their province as a nation in the 1960s?,0
000032939017120e6e44,"Do you have an adopted dog, how would you encourage people to adopt and not shop?",0
0000412ca6e4628ce2cf,Why does velocity affect time? Does velocity affect space geometry?,0
000042bf85aa498cd78e,How did Otto von Guericke used the Magdeburg hemispheres?,0
0000455dfa3e01eae3af,Can I convert montra helicon D to a mountain bike by just changing the tyres?,0
00004f9a462a357c33be,"Is Gaza slowly becoming Auschwitz, Dachau or Treblinka for Palestinians?",0
00005059a06ee19e11ad,"Why does Quora automatically ban conservative opinions when reported, but does not do the same for liberal views?",0
0000559f875832745e2e,Is it crazy if I wash or wipe my groceries off? Germs are everywhere.,0
00005bd3426b2d0c8305,"Is there such a thing as dressing moderately, and if so, how is that different than dressing modestly?",0
00006e6928c5df60eacb,"Is it just me or have you ever been in this phase wherein you became ignorant to the people you once loved, completely disregarding their feelings/lives so you get to have something go your way and feel temporarily at ease. How did things change?",0
000075f67dd595c3deb5,What can you say about feminism?,0
000076f3b42776c692de,How were the Calgary Flames founded?,0
000089792b3fc8026741,"What is the dumbest, yet possibly true explanation for Trump being elected?",0
000092a90bcfbfe8cd88,Can we use our external hard disk as a OS as well as for data storage.will the data be affected?,0
000095680e41a9a6f6e3,"I am 30, living at home and have no boyfriend. I would love a boyfriend and my own home. How can I progress my situation?",0
0000a89942e3143e333a,What do you know about Bram Fischer and the Rivonia Trial?,0
0000b8e1279eaa0a7062,How difficult is it to find a good instructor to take a class near you?,0
0000bc0f62500f55959f,Have you licked the skin of a corpse?,0
0000ce6c31f14d3e09ec,Do you think Amazon will adopt an in house approach to manufacturing similar to the Tesla or Space X business models?,0
0000d329332845b8a7fa,How many baronies might exist within a county palatine?,0
0000dd973dfd35508c16,How I know whether a girl had done sex before sex with me?,0
0000e4d455f9c8877dc9,How do I become a fast learner both in my professional career and in my personal life?,0
0000e91571b60c2fb487,Has the United States become the largest dictatorship in the world?,1
000101ac65db6e4a1c13,"What is the strangest phenomenon you know of, have witnessed or have generated in the area of electronics that has no explanation in terms of modern physics?",0
00010632971fe5e3e0e2,Should I leave my friends and find new ones?,0
00010a2e064c3e8f152a,Can you make Amazon Alexa trigger events in the browser?,0
00012011b6c7759461e8,Why haven't two democracies never ever went for a full fledged war? What stops them?,0
00012fd5128d576260ab,How can I top CBSE in 6 months?,0
0001303b1799a042b26b,What should I know before visiting Mcleodganj and doing the Triund trek?,0
00013a8152b5f37b780e,How do modern military submarines reduce noise to achieve stealth?,0
00013ceca3f624b09f42,Which babies are more sweeter to their parents? Dark skin babies or light skin babies?,1
00014b4f153c26b02df2,How can I remove black heads which are all over my nose?,0
00017146167b4072ae5f,"If lightsabers are created by individual wielders, does each saber have unique powers/abilities?",0
00017aad73813a93e79d,Is anyone still using Visual Basic? Is it worth learning in 2018? Would there be professional jobs for Visual Basic programmers in 2018-19-20?,0
00017b03f780a558fb23,What is Sykes Enterprises all about?,0
0001919a5af9610c95c9,Is there any clear relations between the number of nodes/DOFs and the computational performances and requirements in FEA or CFD analyses (for ANSYS solutions in particular)?,0
00019e410e5002f1dc8d,"Why my package still is ISC since May 31,2017 and I don't have updated?",0
00019e6de5c31a235308,What does great wit mean?,0
0001acfd80069f051d5a,"In your experience working with Realtors, what do you wish Realtors did better?",0
0001ad0e065679a75450,How do I get charge by contact?,0
0001b135fa7979a6f1f1,Do all public school teachers automatically get vacation whenever they ask for it?,0
0001b70b617623c8ec11,What is the role of technology in using a resource?,0
0001b85e3c9fa5120e8d,Should I opt Jaypee University Guna for mechanical engineering?,0
0001d772cf3019016119,Where can I download Microsoft Word for Windows 2.0 in Hungarian?,0
0001dffd4f210f6beedb,What do I need to know about buying a car in South Africa as an American?,0
0001eebc552c65f7cec2,"As someone who didn't enjoy Harry Potter and the Order of the Phoenix movie, can I at least enjoy the book of it?",0
0001f0071f939299b1eb,"What is the writing style of the book ""How to Resist Prince Charming"" by Linda Kage?",0
00020645f451fd420349,My mother expects me to memorize all her usernames and passwords. How can I make her more responsible about them as I will be going to college in one year?,0
000209378782897bbd75,"What is that movie in which a kid is fooled into thinking that germs will kill him and so he lives in a bubble for most of his life, but then decides to travel the world in a portable germ-free bubble?",0
00021a90cbe0ce61b32a,"Why most of the computer science student buy final year project from outside rather doing it by own, is our education system really that week?",0
00021d9215546ed1218e,"What are some ways to shorten your period, and what are the risks of doing it?",0
00022b535fb044b4d890,Why do we calead leap year.?,0
000249b78b87885aae04,How many days will it take to get rid of spleen enlargement?,0
00025639893f22884858,"Which machine learning techniques can be used to extract metadata (font color, size, indentation and alignment) of a word document (.docx) file, and can it be integrated with a web application?",0
000256f123aa2d179519,Does it work with girls the way Hitch Will Smith asks not to dance too much?,0
00027243b612fd34c656,Why India Act 1935 was so special?,0
00028c229b2c0b653c9f,Are there any sports that you don't like?,0
0002911c277ef4279692,How do DNA and RNA compare and contrast?,0
00029d76717deaff60f6,Someone breaks into your house you shoot and kill them they were armed with only a knife what happens now?,0
0002a5d3323091795169,How can I write a biography about Gianni Versace?,0
0002afefccf8ba6bc77a,Are extroverted better and faster at processing and expelling information than introverts?,0
0002b9d73d24af32a648,Have you ever been recognized at a place very far from your home?,0
0002bab68e02485cb64a,Why do price comparison websites work well in financial services?,0
0002c107cf3c31895a5b,Does ragging happen at NIFT Bangalore?,0
0002c3835360dcb57597,Why their are so many bad reviews of Bahubali 2 on IMDb?,0
0002e51174cc70f6c8f7,Is swallowing Listerine dangerous?,0
0002f3b3cfe43608d043,What are the theories in critical thinking?,0
0002f70cd6c744df04fb,"What are the biggest problems, questions, doubts that you come across when trying to choose the paint color for a room?",0
0002f8ab3bf8d179a3b8,How can I get cheap flights in Edinburgh?,0
0003105b9e363b93d2cb,What is China's new chick?,0
000328ae66a708c0622d,How do I send large picture files through an email?,0
0003295da69adf36fd0c,Why doesn't eBay allow the sale of WWII purple heart medals even though they have categories specifically for WWII military medals?,0
00032cb9dab5b4033cc4,What are the characteristics that define isovolumetric relaxation?,0
00032ccff3c5f6fc0d00,How do I work in cybersecurity overseas?,0
00033991dd3302d609e2,Do web developer refer to W3C standard practice?,0
000349b6feabae3f6253,Why has the internet become a problem? Why do we rely on it for everything?,0
00034c0cdb2a9a04be3e,Can we get ITC on charges levied by banks?,0
00034d41fede3435d72c,Where is Muhammed now?,0
0003637c6061714d52a2,What are the services that can be provided by a food testing lab and what are their certified requirements?,0
00038603da34d34f87cd,Is it ok to be solo your whole life and pretend no one exists? Is there such thing as being unwanted?,0
0003888b6173d1b67eda,How do I change the owner of a current YouTube account? The original Owner was let go and I do not have access to change anything.,0
00038db9f9728f7e1775,Are the Archer characters animated based on celebrities?,0
00038ee6bf4553590414,What is the best way to propose a girl without annoying her?,0
0003a067fbf4d02393a2,What can $500 million get you in solar power?,0
0003a1d388c596990438,What are the recommended 2D game engines for a beginning Python programmer?,0
0003a32a4c69db9ba24c,Is there such a thing as teleological pantheism?,0
0003a3c38ffc828004d8,What are some best college for aircraft propulsion(M.S)?,0
0003bc3a60964971ddfd,What countries in the world have freedom of speech on par with the US?,0
0003c2d35a826c62f194,What lead to the Red Terror in Ethiopia?,0
0003cf279e2d16706bfb,What is the best pen at low cost in all sorts of things?,0
0003d2546ef7cfb68592,Do you trust a business that has a Facebook page as its website?,0
0003dd88b54929c683bd,Should we improve our piano skill by keep practicing hard pieces? Is that the most effective way?,0
0003ec83eeb432806fb4,"I wear an insulin pump, and a lot of girls don't like it. Nick Jonas wears one and dated Selena Gomez. Is there difference between me and Nick several zeros missing in my bank account?",0
0003ed83c24563455692,Will Turkey be seperated and give a land to Kurds because of foreign powers like USA in the future?,0
0003f094c836f6fb71e7,R sq. cos-1 when r=18.5 equals?,0
0004186360074b604164,Who sings the song in my head?,0
00041ab3e4fc034848cf,Can Chronicled replace supply Chain?,0
00041ba380e361cefb78,How can you solve this equation… Sin(a*t)-b*t=0?,0
0004205e9c6b9cbde64d,What are the demerits of excellence in academic pursuits?,0
000422c7d78c3664b426,"How many Indians are in Melbourne, Australia?",0
00043c2c68e74328c456,"What do physicists, mathematicians, computer scientists and philosophers think of David Deutsch's 'Constructor Theory'?",0
00043d911af1cfbdb5f3,Why are old scriptures from eastern cultures appear lost in the current culture?,0
000441059c27001eb255,"Can I know my I.Q, even if I hate numbers?",0
00045f3b9fcb27975e26,How can I really make up my mind and get rid of my bad habits like procrastination?,0
00046512985c0996339e,Was there any relationship between Napoleon and Ali Pasha of Tepelene?,0
000467723d6f04760035,Where are presynaptic neurons found?,0
000477ab08d14b6a047d,What ways will a narcissist mother punish her child for going no contact if child goes back to contact with her?,0
000485e6dd4b149fe051,Can I start freelancing after finishing Udacity's Android basic nanodegree?,0
000488ff2dbaa802b4d9,What is the reason why we really need Bitcoin?,0
0004a41beea5f02d85ef,What are some good songs for a long journey?,0
0004a7fcb2bf73076489,If blacks support school choice and mandatory sentencing for criminals why don't they vote Republican?,1
000500e5d543e112707e,What should be added to thrice the rational number -8/9 to get 4/7?,0
0005037036efa7507699,"In a four movement symphony, what is typically the form of the second movement?",0
000525a468b75805135d,What are various stock exchanges?,0
00052793eaa287aff1e1,"I am gay boy and I love my cousin (boy). He is sexy, but I dont know what to do. He is hot, and I want to see his di**. What should I do?",1
000537213b01fd77b58a,Which races have the smallest penis?,1
0005401e50ab76bb603d,"What do the terms Computer Architecture, Microarchitecture and Instruction set Architecture(ISA) mean?",0
000546d4647809387b91,"Are iPhone users psychologically trapped in brand naming and avoiding to complain about very reasonable missing features such as battery life performance, that iPhone lacks while other flagship in 2017-2018 are doing doing much better?",0
00056c4d8c51ad92d3d1,How long is one semester in Ontario?,0
00056d45a1ce63856fc6,Why do females find penises ugly?,1
000585cb79d4fad61fb0,What are the best ways to add flour to a homemade chili?,0
0005893de9a677ad97c2,What advice do you have for anyone who wishes to accomplish what you have?,0
00059fdb387101ce73d3,How do overcome my extreme fear of insects and bugs?,0
00059fe5d7eea7b17e77,What are some examples of durable work gloves?,0
0005a7bae94f5a721613,"2 cars move 6 miles towards each other and then move 8 miles in oppostie direction, what is the distance between them?",0
0005ac1fb4efa2e7f266,What apps do you use the most for work in a given day?,0
0005c5586f8ced327bf2,Can R only take a maximum 100 headers in a dataset? I noticed it will only print the first 100. Is there anyway to change that?,0
0005de07b07a17046e27,How do I marry an American woman for a Green Card? How much do they charge?,1
0005f305899be65ed771,What do companies look for when recruiting expat? Does the nationality of the candidate play a huge role?,0
0005f8861d29aacb4909,Can transcranial magnetic stimulation (TMS) be used to increase cognitive performance?,0
00060eef307e44d35aa7,"But, why did George Washington free his slaves after what had happened in the Revolutionary War? I think he should have",0
0006120a998ee39f3db4,Has the time come for India to adopt one-child policy?,0
000619c09cbb8abcea8c,Can a US embassy deny a US citizen entry into the embassy?,0
000623eb912267110a7f,What should I wear to a 1920s party?,0
00062d609f01adde882c,Why should we test an energy meter periodically?,0
000632a66ce2d0eb5359,What is the best stationery for the home office vs the regular office?,0
00063822d9496e6c1619,Where can I find genuine aviation jobs?,0
00064a6202ac8f744659,Why do nonprofit organizations treat their employees so badly?,0
00066031b0e6063b9783,What is the procedure to invest in mutual fund?,0
0006749b46d9fac9b6c7,What is osn?,0
0006762162ee6102e8ba,What is the most aesthetically pleasing shade of green?,0
000684dc9b810e3484c5,Is it wise to do M.Com (2017-2019) in Calcutta University and start preparing for CAT 2018?,0
000685d7619cd29b567d,What is the difference between a politician and a leech?,0
000688582e3a2059d832,Why does China not sponsor a regime change in North Korea?,0
00068875d7c82a5bcf88,"Why do Europeans say they're the superior race, when in fact it took them over 2,000 years until mid 19th century to surpass China's largest economy?",1
00069d1cac3cfd3c2ec4,Why does the cytoplasm built up inside my lip?,0
00069ea4b91cb234dede,"If I'm creating an app using multiple programming languages, can I use the same IDE?",0
0006a32e24bc29aa5702,"What are the good and bad neighborhoods of Chuncheon, South Korea?",0
0006aa183c4d86daaee7,How was your CPSS/PABT at 4AFSB Varanasi?,0
0006c4b8dcbeccc8ed02,Has someone wrongfully jumped to conclusions about you?,0
0006cdec27ec10525322,How can I start troubleshooting a Hewlett-Packard printer?,0
0006cef484413402be42,Isn't it unfair that only men has military duty in South Korea?,0
0006d421bb5ff8baa03e,How did NSF spinoff from NSFnet helped Sun Microsystem?,0
0006deaf2d3de7d971f9,How dangerous is South Africa for a tourist?,0
0006e38b24fa70b2949a,Have you ever known someone who has drastically changed?,0
0006e88111bf4a918c3e,Why is university of Louisville not listed in QS ranking?,0
0006ffd99a6599ff35b3,Did Julius Caesar bring a tyrannosaurus rex on his campaigns to frighten the Celts into submission?,1
000700a6f0cba0e95868,How will mercury (debilitated) dasa for Simha lagna be?,0
00071a30c053edd69ade,What are the drivers of Globalisation?,0
00071ade809fc7a73a42,What are some people with a high emotional intelligence?,0
000726eb4bf0ebcca8f1,Why do womens (mainstream) fashions change so much compared to mens?,0
00072c4eadfe80d45a4c,What is the cause of magnetic force in magnet?,0
00073b2120522c6bb72c,How are the Nike football towels manufactured?,0
00073ca085d3f2d3d48a,"Who would win, Anizara (Powered Up) from Dragon Ball Super anime episode 121 vs Mystic Gohan (Powered Up) from Dragon Ball Super anime episode 121?",0
00073d32121fb2b83124,Which 4G phone should be best?,0
00074193b630fe1ee9bd,Is it my fault that my teen daughter has bad social anxiety?,0
00075a61a7f7f6badf94,Sunil and Raju are absent today? Is or are? Which is appropriate?,0
00075f7061837807c69f,In what manner has Republican backing of 'states rights' been hypocritical and what ways have they actually restricted the ability of states to make their own laws?,1
00076debbd82860ca33a,"Would Europeans continue to participate in the Arab war for the destruction of Israel and killing all the Jews, if they knew that god himself defends Israel and he will do to Europeans what the Arabs want to do to the Jews?",1
00078617bb9090b1e9cd,How do you start a conversation on Quora?,0
0007a04df07cfffbd57f,Which PHP framework should I choose for a website like OLX?,0
0007ac776554ab510dd3,What do you do as a forensic psychologist?,0
0007adf025f36909b7f5,What can I do to be a better student in school?,0
0007b4c274692e3c64ae,Why does Fortnite lag everytime I’m fighting someone?,0
0007cbd9381647f3b8bf,What are 5 examples of neurotransmitters?,0
0007d02f7daf548678c2,Why are puppies so hyper?,0
0007dfa486fbf6beb840,"Is Jhargram, Birbhum a safe place to visit in winter or there is any fear of terrorist or something?",0
0007f9c2973ff3a3d7ec,How can I discover the one thing to change my life instantly?,0
000809362bf3e0d58a37,Why does my puppy lick his paws?,0
0008304e8c820a60d160,Which is best powerbank for iPhone 7 in India?,0
00083b24297e4e627776,"If an average NFL team obtained a kicker who could consistently make a field goals from 100 yards, would they win the Super Bowl?",0
00083b5c34d0b450557f,Can I kill myself now?,0
00084795e25cb5ddc2fc,How can one earn from trading in derivative market?,0
00084bd3de3fbb2bc124,What are some of the fastest cars in the world?,0
000861ec8c798f929f3c,When can we know God's timing?,0
00087b810447c83e508b,What should I learn after HTML&CSS to become a good Front-End developer?,0
0008819c735204821d7d,Why do Lingayats bury their dead rather than burn like the other Hindus?,0
000892d68b1b103744d8,Is there a therapist who can help me regarding mental health issues?,0
0008d04b7d99d9a4f3c8,What is the remaining useful life for a Honda Step WGN with a mileage of 170000?,0
0008d0a5694cd04caf60,"Do you think it's a sign of progress that Singaporeans are adopting British, American, and Australian accents?",0
0008d4b9f4f900554027,"I'm the DS Pokémon Diamond game, how do you get to the top of Mt. Coronet?",0
0008d70754ce2285a568,How do I create a merchant tracking system?,0
0008d98781f4dc1e3676,What is your life like 5 years from today?,0
0008de6b1e6f9ed1f482,Why do people smoke clove cigarettes if they are very harmful?,0
0008e27768ec30823036,How is Arnab Goswami able to ignore so many defamation cases against him while Kejriwal is being dragged to court everyday on such cases?,0
0008e6b80183d5bb1a29,Which is the best Institute for Big Data Hadoop course in Chandigarh?,0
00090a521c5dcb091f09,What is the clipboard feature on a computer?,0
00091d5329e4e47d7740,What is the best place to buy maths/physics T-shirts?,0
00091e28b6fe65b3d7d0,Does the people who are rich and still claim reservation have any conscience? Why are they given reservation if are rich?,0
00092087b5cd4d0e35ec,"Are there instances of Medieval Latin text being later ""translated"" into Classical Latin (for the purpose of comparison)?",0
000934e6df8834d73416,Which location is the best for an investment in Gurgaon?,0
00093d949dae61157bfa,Both me and my husband are having myopia. I want to prevent our child from this (not yet conceive).is it possible?,0
0009418c618cbc346741,How does it feel to travel 1500mph in a fighter jet from the airforces?,0
0009431c339a3a325136,Which book is good for power electronics?,0
00094853b382cadcb87a,How is it possible to make directory on Linux with size of Megabites? How does it happen?,0
0009627232926d8046c2,"When going to an interview, is it a good idea to wear a black shirt with the suit, or wear the standard white or other light colored shirt?",0
000962a8630247e5cde9,Does every stammering have melodious voice?,0
000970d4f34cd766e987,What are the five types of personal fouls in basetball?,0
000983f5b226cca636f4,"Why are Americans, British, Canadians, Australians and New Zealanders considered to be separate nations even when they all speak the same language?",1
000991ab5fb52c52f21d,Which is best changer for Redmi note 4?,0
0009a8f035c85f8ff09a,At what point do you give up trying to stay friends with someone?,0
0009ab58250f91a042d1,What are the characteristics that define the frequency division multiple access (FDMA)?,0
0009dc24c9049a2bde47,How we can Use new line in vb can you explain with example?,0
0009e4cc52f8c76b9f5a,"Do you want a funeral? If so, what for?",0
0009fcb845bb24de91f4,"If both Honey Singh and Justin Bieber fall from the 5th floor, who will survive?",1
000a0e7d0a0eded925c5,What makes you laugh the most and the loudest?,0
000a1b32dfa3fc274910,Do you have to hold a professional state license to be a mandated reporter?,0
000a2215c5289a703007,What is the worst emergency that has occurred on ISS?,0
000a3f6d08af9526d6f9,What is cost of guru granth sahib Punjabi?,0
000a494ee432d9ce9289,What women feel when she ruin the life of man by falsly accused him for rape/domestic violence?,0
000a58d0813f84a1819a,Who built Fort Louis in Pondicherry a particular name?,0
000a6356c57ff8cd5c97,What is the best Nootropics stack that balances performance and risk?,0
000a7ce3b24ed2a4098f,How hard is it to be accepted to CS MSc at Université de Montréal?,0
000a898069f8ee9c963f,"With the introduction of GST, what is the meaning left of Maximum Retail Price of products as there is one nation one tax now?",0
000a898565e80fe124bf,Why are liberal minorities so voilent towards poeple with diffrent poltical beleifs? Should supporting trump be a sentence to be imprisoned or savegely attacked?,1
000a8cc0959b3e0c1937,Is 1 trillion dollars enough to create the Starship Enterprise?,0
000a8efbcf86702146e6,What are the mating habits of alligators?,0
000a9b3a426f3fc63fe8,How did Meetic become publicly quoted in 2005?,0
000abdbd0a23f13ccfef,"Which is better to use, Avro or ORC?",0
000acaaafe022357b3cc,How old would Neil Armstrong be today?,0
000ad2899aecc8fdd8bd,Why doesn't Telemundo film most of their telenovelas in the United States and not Mexico although the Telemundo headquarters are in Florida?,0
000ad33b966e378f272e,Can you return a new vehicle if you don't like it?,0
000ada01800e6154e6f7,Which is better PSU to join between oil and ONGC? I have been selected in both the companies for the same profile and same pay as is the case in PSUs. Which company should I prefer and why?,0
000adf4573a50193d08b,"What are some of the ""undervalued"" technologies now that you see will make a big impact in the future?",0
000af63eecd62d7b2175,What is the main role of carbohydrates in a human's diet?,0
000b1f4cbc5c238a765d,Can we all now admit that President Trump doesn't really want Congress to pass legislation replacing DACA to protect dreamers?,1
000b354cd565014e2d47,"If you are from EEE branch at Manipal, can you pick up any coding or IT related subjects as minor?",0
000b4c60e741410a51f9,How does website like ohmagawd.com or 9gag.com make money?,0
000b4fcd95ddaad94763,What area some steps that I need to take in my Ph.D. in order to be able to launch a consulting firm right after it?,0
000b5c2bb7bb510f2de2,Can you leave a battery blanket plugged in over night?,0
000b5c5c4efc832a5bf6,How do you feel about relationships with people who are disabled?,0
000b5c707ff6631e2d1d,"Sourcing and procurement Folks, have you used a CRM (like Salesforce) to manage your vendors/suppliers and contracts? If not, then what *do* you use?",0
000b5eb278abb46ace82,What does it mean that my boyfriend of 3 years almost always has 2 or 3 ejaculations without losing an erection when he is with me? It's great. But is that normal?,0
000b73ce7cd1dd030a6c,Where is Srinagar Garhwal and what are the places to visit there?,0
000b90ae1a85f8c987e8,What happens when you are accused of plagiarism?,0
000baf23e1b4781b3d78,Why do people need to talk about their pain?,0
000baf4ea51fa25b7386,Where do I buy best dry fruits in Hyderabad India?,0
000bafba6eb66c389173,"I have a best friend and I want to spend some personal time with him, but he keeps inviting other people to come join us, how do I tell him I want some 'us' time without him thinking weird of it?",0
000bbe5480ee6f164225,How can I install FIFA.18-DUPLEX on PS3 through a USB?,0
000bd158afb93d3e1fdd,What are the characteristics of Performix SST fat burner?,0
000bd9bfae4340454d07,Do icy cold water help pain in hand?,0
000be9066a1ecba545fe,"When will the Gulenist movement stop being falsely accused of crimes it didn't commit, and stop being oppressed?",0
000beceeb5e8b76c2c0f,Is there a time you felt like killing yourself because you couldn't escape an eternal torment of the same thing over and over?,0
000bed38465943ba8a4e,How do you germinate hen and chicks poppies?,0
000bf5f84797cc477c16,Which college majors will increase my chances of getting a high paying job?,0
000bf7c18b05ec543a21,How to download mp3 song with artist photo?,0
000c10d3987148a9943b,How many robots work in New York City?,0
000c2b2bdb6ffb1386b7,What does run app for 30 seconds mean?,0
000c3e93ce7d3c57c62f,Woes mercury and Venuas have a moon?,0
000c40410c118c9e9f17,Can dogs actually cry out of sadness?,0
000c44fe9b2822b25d77,"The American economy is growing under Trump’s presidency, why do people still hate Trump as a president?",1
000c459bf5f51ed1c165,What are the scope of electronics and communication branch?,0
000c5b121137bd829c21,"As of April 2018, what is Barack Obama current up to? How is he spending his time and energy?",0
000c6212d04c658b8ac7,"When is leverage investment (ie., borrow to invest) a viable option?",0
000c651af5d428f4cdbc,Which is the best projector under 30000 rupees?,0
