qid,question_text,target
000c6a0c4bb17dd41317,What's the scariest thing that ever happened to anyone?,0
000c6f701e9a2cdd38ff,How do I make a gravitational wave transmitter antenna?,0
000c81c872aa77615063,Is RLE International (Chennai branch) worth for career development?,0
000c939ec7014b7c1d36,Is there a difference between watching videos for knowledge vs reading for knowledge? Which medium leads to the best outcome?,0
000ca6318c971b2fe333,How are we supposed to get these guys out of Spider-Man web ball?,0
000cbf7232baf8039a01,What is an example of Pakkstani-Indian collaboration?,0
000cca91dba673eaaf2d,Is there a chicken breed that is known for producing extra large yolks regardless the size of their eggs?,0
000cd1bcfa93fc5ff7a0,Is settling in Germany easy?,0
000ce2fa8275fdd2286a,Is Trump's speech at the Value Voters Summit a presidential endorsement of homophobia?,0
000d0c95bccf3b3b51fb,"What are + R,-R,+I,-I groups in organic chemistry?",0
000d317a563d0f459560,What is the diff () serotype and biotypes of bacteria?,0
000d3e56ac4ea11b91d3,What component can you use to transition from 5DCV to 230ACV?,0
000d62333158387dc542,"I'm considering to buy a bike, a 1000cc Japanese one. Which is better, CBR1000RR, R1, GSX-R 1000, or the ZX-10R?",0
000d64579fac9793f07e,Which is the most culturally diverse city the United States?,0
000d64a807bdbd25facc,"If energy can neither be created nor destroyed, then how does it even exist (because no one can create it)?",0
000d74a6b9ee0af48902,What is the procedure to get admission in IPU for LLB?,0
000d80ae794a9801c172,How do I win my divorce over my narcissistic ex?,0
000d81e34a8af824dfa5,What would happen if every iPhone ever sold exploded at the same time?,0
000d8833502245f9f83e,How do I redecorate my room without money?,0
000d90007a04604a218b,How much time would it take for China to destroy the whole India?,0
000d90f98fbfa637da92,Is 26 too late to learn programming and make a career in it?,0
000d9de4df8d6a31c248,"Why don't poor countries print more money to use for paying for education, etc.?",1
000da75cfe5924113141,"Who do you like more, My chemical Romance or Elvis Presley?",0
000dae3d986c14c25669,The girl I'm talking to isn't looking for a romantic relationship. Should I ask if there's a possibility in the future?,0
000db4d0223af5dd9c5d,Why do all the people who claim Florida has great weather go silent every time there's a new hurricane?,1
000db7c1b90ffd31571a,Should I factory reset my MacBook or get a new computer?,0
000db9603d16a6d9bb2e,Could the leader of Iran be dead many years ago and the leader of today's Iran is actually a fake leader?,1
000dbe8b37fbca514e70,What are some quotes from Tomás de Torquemada?,0
000dc2a94b31f4094299,Which programming language should I learn to open a software company?,0
000dd21134d66907aadd,Is laser a good option to remove these blavk lines around my nose?,0
000ddb6af0016f66ad72,What are some spicy Italian food recipes?,0
000df7b9f388107d520a,How can low productivity lead to lower incomes in a closed economy?,0
000e08379251d7ec6d84,How can you tell a jerk from a narcissist?,0
000e1599193fa7f1272d,Have you ever run an online background check on someone? What prompted you to do it?,0
000e35c1b068b79818bc,Which software do I prefer good for GST billings?,0
000e3cb28879723bdf08,What is the largest rattlesnake that can be found in Florida?,0
000e48ce4edaaecfa9c9,Do you think we all deserve happiness?,0
000e67648fce55f011be,Why do the Liberals who run schools choose not to have controlled access? The kids in Florida were killed due to an unlocked door.,1
000e6a4eaa936ee491d6,"Among these practices, which do you consider as strenghts that any preschool should possess?",0
000e6a6cc25e7ca35108,How does the society react during your term breaks at NDA?,0
000e852896013d66612d,Do intelligent people ask questions?,0
000e8dca91f77f37ef15,Why do I feel sad watching my parents age?,0
000e95659e8ae0d02e8d,How can I use Python in biological researchers?,0
000e98a799912acba95c,Was Count Dooku a Sith Lord?,0
000e9a4cf5161289f4c6,What led to the success of British efforts to claim the territory where Aboriginal Australians lived?,0
000e9e3c682fadf1660f,Is there any typing app on Bodhi Linux?,0
000eac9224942c693553,Why aren't lives of all animals equal?,0
000ebe82a0fcefa57576,How can I legally use a web link in a court of law if that link doesn't exist anymore?,0
000ed9037bf56f0141f2,What is input subsidy?,0
000ee7cb10ea4d504fb3,How can I create the most exciting essay to read?,0
000f0266e12c3349db07,Why did Pakistan pass the Sikh Marriage Act before India?,1
000f0d292f0a3b0653a1,"What is another word for ""hello""?",0
000f13be742404120762,What’s it like living in the ghetto?,0
000f18c16657fa93937e,Is there a good Christian devotional about dating?,0
000f1b0ea54e4f85d067,What are the main working of big data?,0
000f2043ea1e37c9252d,How can I prevent my septic tank from overflowing?,0
000f217fedc9e372a497,"What does the average survivor of 9/11 and families of the victims think about what really happened that day, esp. fire fighters who were there?",0
000f24553c7779f4d7ad,"When did late medieval middle easterners, near easterner, nomads, and mongols eat their meals?",0
000f2a833d52415d5193,How can the psychology of aging be explained?,0
000f2ab3c3f3d1dc9aca,Which app is best to listen to kpop music?,0
000f3e60cd27ddff29b6,Is our nationalism on social media only?,0
000f457e9308b3f9e226,Where is the best place for window tinting in Greenville SC?,0
000f6283211729f7c46d,Why does the HR guys in my company gives me cold shoulder?,0
000f6be2f3e7c85a817c,What is the process of issuing corporate bonds?,0
000f6e90250058db13f8,What are some useful tips for someone who is starting work at Raymond James?,0
000f74b74811061ef1c1,How did you lose that last layer of stubborn fat?,0
000f80f63b53d75c1bc6,Which engineering branch should be choose to apply for junior scientist in ISRO?,0
000f83fbc0c5271b10c7,What creative jobs can I take up and where?,0
000f89527b907f3ef20f,How do I train my dogs to kill raccoons?,1
000f99673b28ec3cdcc6,Would you forgive your husband if you caught him having sex with his favorite celibrity? If he later says he couldn't control himself as his lifetime fantasy was becoming true.?,0
000fa05b96360b09d918,Can downloading pirated content be considered as a violation of the second precept of Buddhism?,0
000fa15cd1704c36e8da,Why is it that arranged marriages which happened in our previous generation have greater chances of surviving the entire life duration as compared to the ones happening in our generation?,0
000fa20f6b5d34806956,"What is a good example explaining ""Occam's razor""?",0
000fa43c185b0e723c04,Why does life gives pain and sadness?,0
000faa28df1b0202ef7a,How can I tackle obsession?,0
000fb56f821f7b991a60,What are the advantages and disadvantages of Automatic Headlamp On (AHO) especially in two wheelers in India?,0
000fc2131c43a6aeca09,What things doing daily will change one's ecomonic condition and personality?,0
000fec11ee7a68e2ddd9,What is the best way to learn manga drawing?,0
000fec4330297b720414,"When writing manual test cases and scripts, how much detail is too much detail when documenting the steps?",0
000fed754b3e9759b6e7,What are some small yet important battles that occurred in WW2?,0
000ff470e9dc7d79812e,Is this the best time to buy a Kyber token at 1.11$ as of the 16th of Oct 17′?,0
000ff5b77bdf38edd68f,Why did my taskbar stopped responding?,0
000ff84c2bdb76e321ec,What are the best way to answer a question on Quora and get more up vote?,0
000ffff5789ceee45fbf,Can I use images from other blogs just giving credit to the original author?,0
00101521340fbc63fda9,Shouldn't Republicans be given a free pass to run the government any way they see fit?,0
001022d12bfab8d753fe,Did the British parliament just abolish itself?,0
00102c6dfb293c89ef58,How can I apply for TOPIK exam in India online?,0
00103c904de1fe60b3a5,What is better than steak?,0
00103cba47bd1a42f4d5,Dis advantages of education?,0
001041f073bfb86008c7,Is there a way to start a MongoDB server from a mongodump without having to use mongorestore?,0
001045dbd72a861e5ae4,Why do people feel hesitate or humiliate while speaking Hindi?,0
00104d9fed0f1b2ca3a7,How should I prepare for ESE 2019 (civil) if I had 200-204 marks in ESE 2018 and I am in my last semester of college?,0
001050f9841f044bde8a,Ingredio milk shake was harmful to use long time?,0
00105ef0a117c7754288,What are some examples of motion- Without Force?,0
001098c545349ea8274a,What is Transient Voltage?,0
0010acc928245de6f970,What is bass heads?,0
0010af3f927996ec6fcb,"Why is the poem ""Ramayana"" one of the largest ancient epics in world literature?",0
0010b8bd37af629de2f9,"Is there any woman (other than Muslim) who is happy after marrying a Muslim guy, as there are a lot of answers on Quora about love jihad, and all of them suffered a lot after marrying a Muslim guy?",1
0010dd983174c34137a7,How does the chain rule work?,0
0011057dd227880dc19e,What happens when a computer needs to be accessed for an investigation? What tools do the police use?,0
001109746171c9c307ea,Are there many famous polygamist celebrities in modern day Indonesia today?,0
001114dd925872729b57,Which are the best trusted sites for applying scholarships in class 11? I scored good marks in 10th.,0
0011338ac72e50ab8956,Which book is best in British history for graduation?,0
00113c28d51d8fedb274,What is the best free online lecture video site for neet PG and MBBS?,0
00114e32e21f1f7643bf,How good is the Bachelor of Information Technology from the University of Queensland Australia?,0
00115a863d499b21b0a9,How does the rise of China change the view of dictatorship?,0
00115e65770f677c33b5,If it possible to score a good sectional percentile in LRDI by only solving DI questions?,0
00115f7576aa11f88a62,How is the best way to speak English like a British?,0
00116d5fa82130ae3b2c,How can I do scientific research and get published at age 15?,0
00116e2438bb8746297f,Which are the best places to party in Bangalore?,0
0011763babe21a3a9591,Is it safe to invest larger amount of money in online stock market trading in India? If not what would be the alternative solutions?,0
00118ac919436a6a4f58,How much does increasing funding for education increase the quality of education?,0
001190d9b18d54008279,Why do bushfires happen?,0
0011cf7f36da9a2a742b,What are the best ways to clean your Remington Woodmaster model 742 .30-06?,0
0011d60461995abd2c5c,Why do police officers get to go on paid administrative leave before getting fired where the average joe just gets fired? Who negotiated this inequality?,0
0011ecf86bc06b14e00a,How can I become certified in Revit?,0
0011f05559d7a04ae35a,What is the primary cause of Post-Traumatic Stress disorder in the Military?,0
0011f638325960db439f,Is a soy latte a healthy drink?,0
0011fc21004d8d29893b,Why would a deployed Army Ranger ask for a Steam Gift Card?,0
001201bb254c652189ca,Which type of clutch is used in Activa?,0
001213994b375f405bfe,"In psychology, what is compliance?",0
00121f19821256eca5ce,"As an exceptionally or profound gifted individual, which way of thinking is most dominant, verbal or non-verbal?",0
001220e1d599603b8466,How much weight can I stack on top of my laptop?,0
00122f1f19b2d4434d9a,How do I become scientist after class 12?,0
00123d8a45b24c9b898b,"Why if a man who has had me over 5 times. Who we both know are attracted to and like each other, ask why I came when he asks me over? Is he looking for confirmation? When there I stay for 3/4 hours at a time.",0
0012439dc9922b4ef662,How much a new lawyer earns in India? And how many types of lawyers are there?,0
00125c47ee25377049c5,My Samsung Galaxy S6 edge is not being recognized by any PC's or USB flash drives. How can I fix this issue?,0
001260650fca0b3b6843,What would have Stalin thought of the late cold war era Soviet Union?,0
0012607de5388946c2f2,"Which army was better, Spartan or Roman?",0
00128a318c9bae69c512,What should I reply when I ask my friend for a little help and he tells me jocularly that I will have to pay for his help?,0
00128e3fb2407e8da0dd,What are the steps to become an analyst in cricket (be it video or data)?,0
0012b33ee2f20e29bfc8,What are some characteristics of deoxyribose and ribose sugar?,0
0012bba774c13ce9cc9e,Do moms have sex with their sons?,1
0012bcf832eb0d8ee1b3,Is dear Zindagi a good movie?,0
0012d1c7679cab46dd1d,What is it like to work as an employee for Oprah?,0
0012d72ccc14e9329f97,"Why did the Pope say that ""Muslims are a curse to this world""?",1
0012d9af133219e1b370,What is the meaning of relationship with a girl from two year?,0
0012ebc312afe63fcc03,Which MBA program is suitable for a doctor in the field of private practice for over 30 years?,0
001307632a5ccfb0f0fe,Why didn't the Romans conquer Ireland they failed to conquer Scotland?,0
001308fe22177d2c5979,How much money do I need to buy a gas station?,0
0013149f6c49a3bd112b,What is the ladder operator method for determining the energy eigenvalues in a quantum harmonic oscillator?,0
00133ee08b5cc3b60b39,"If XRP doesn't gain mass adoption, what would most likely be the causes?",0
00134ea8067289ad217b,What animals are native to Spain?,0
001367d37bb73f5c0bb5,Can coffee make you more productive?,0
00136ce70824056f2421,Create the most advanced animal ever from currently living or extinct species…?,0
00137a13c7873f46bbf6,Where is a good place for filming time lapse videos of planes landing in Heathrow airport?,0
00138b3457747a7274ee,What are the roles of Royal British Guards?,0
00138c86bf37c140da22,"Excluding online / e-commerce businesses like Uber & AirBnB, what's the best referral program you've heard about or used?",0
00139880baef1e0b7d3e,What was the main reason of conflict between Suhrawardy and Bhashani?,0
0013a124ad120f50d7e4,Can I buy airticket with Amadeus after booking it? And how?,0
0013a1a5d95e750a7c05,Why can't I become a businessman?,0
0013bc848755b882e15f,Can weed be a good antidepressant?,0
0013c534c0445765d0a8,How much is the world worth?,0
0013c80c2c574eebe13e,"If you had to choose between Instagram and Quora, what would you choose?",0
0013e200c87d0df0e449,What is the past form of must have been?,0
0013e5845d851279d615,What are some of the good textbooks for learning philosophical logic for an absolute beginner?,0
0013f652696acac41861,How can we Indians make Sri Lankan people understand that India created and funded the LTTE for the benefit of Sri Lanka itself and India didn't have any ill intentions?,0
001406b747da3e9bba46,What is the best way to consume a lot of educational material?,0
001407d1e10d41769bbf,Can my followers see my anonymous questions? (Since 2017 anonymity changes)?,0
0014203466312aae5737,How does Lady Macbeth plan to kill Duncan in Shakespeare's play?,0
00143146e05399b5f352,Why don't the Gulf Arab post pictures of women in their countries?,0
0014367d617fb78bebb1,How free or democratic is in the USA? What does it mean to you personally?,0
00144cc39182b32d7140,What are the modern superstitions blindly believed by educated masses?,0
00145962517d0096b06c,How can I convince a 6 year old to eat healthy?,0
0014630cb04444f0aac2,What are the disadvantages of using React Native for developing native apps (e.g. instead of Swift)?,0
00147150ab9d03d5238f,What is the mindset and motives of the westerners who join ISIS?,0
00148a87723d5d988a92,How do I become a Delivery partner at Amazon?,0
0014993dba1084051bcf,Who is the sexiest female in the world?,0
0014a0fc6d11cdf9a91f,What happened to LSI Corporation?,0
0014b39cafb14d18529e,I almost constantly feel uneasy. Why?,0
0014b4e71649b951794f,How can I find a government job?,0
0014b857f39294f7d4a5,What is the difference between a split squat and a lunge?,0
0014cb4ffe14aae10a5d,"Where can I download test bank for Entrepreneurship The Art, Science, and Process for Success, Bamford, 2e?",0
0014d3ec37334157ea82,How many students appear for Imucet every year?,0
0014e0200bb280d44ea1,How peoples in India seems hypocritical about womans empowerment?,1
0014e5f03b07bf2a1ff9,What does a certified energy auditor do?,0
0014edac61533ee16e2f,"What really happens in ""flapping/r-voicing"" English dialects when unstressed /t/ or /d/ are preceded by /n/ (e.g. /nt/ and /nd/ in ""winter, blender"")? Is it a nasalized tap [ɾ̃], [nɖ], [nɾ] or just [n] with the /t, d/ dropping (winter-winner merger)?",0
001506059f00dcd93664,"Who are you going to meet, if you go to heaven?",0
0015159fd6d04e51c59a,Why wasn't John Diggle the Green Arrow in Crisis on Earth-X? Arrow S6E7 seemed to conclusively show him taking up the mantle.,0
0015180e5256a2a8d2ec,Do the royals prefer William to Harry?,0
001520c67915547d0dd5,Is it necessary to disclose your salary from the last employer while interviewing in a new company in IT?,0
001552fa2d0f539ba667,How many optionals are there in up pcs 2017 exam?,0
001553af3bcc504208a8,Why is Relational Algebra s the basis for relational databases?,0
001554dbea2fcef5729c,What is the difference between structural breaks and regime shifts?,0
00155a4893a5b19205f0,What's some of the biggest book discussion websites/forums?,0
00157735f6abcfc8106e,When did DeviantArt's fetish culture become as prevalent as it is now? And how can the site moderate this content better without being too tyrannical?,0
001583e5d5aa24fda8d2,On what day are checks being mailed out for July?,0
001586c85a7111e7665f,What kind of therapy can help you forget a memory? Does hypnosis actually work?,0
00159f3f4c3a10024fb9,"Why at times I can sing perfecty and can hit every single note easily, and then at times I stuter when I speak and can't even sing and become out of breathe?",0
0015a0bfd83e1fa30b73,Which black superhero can beat Superman or is as strong as him?,0
0015a1f68b995da44faa,What is the difference between a maverick and an indecisive person?,0
0015a7fe295bf3aa5e97,Why do trading card game copanies pretend like kids are their main demographic when 90% of their customers are above 20 years old?,0
0015b97b99a430fb3717,What different magic does the Lucas sequence have than the Fibonacci?,0
0015cba53efe2d6c40d9,What did you buy on a hunch that turned out to be the smartest investment you ever made?,0
0015e08d95dff9558a93,Can I crack JEE Advanced with AIR 1 if I study one year having good basic knowledge?,0
0015e367aa794e5d547f,How much more political fumbling will it take for Republicans to turn on Trump?,1
0015f2ee7e0a181fe768,What is the most recognizable short story?,0
0015f6db357919f720e8,Does the skin get affected after shaving the hair (skin on arms and legs)?,0
0015fe8cdaeb6f701d3e,How can I use real time database on my WordPress website?,0
00160e2b98f581e21ec8,What are the procedures (FORMS) to be followed to accept loans from director is a NRI?,0
00161181689a550478f9,What if the Indians had been in place of the Red Sox in the 2007 World Series?,0
00161b740203d84cc264,Why are citizens of The Netherlands called Dutch?,0
00162c09fea2168a32e2,Why do so many Asians wear masks?,0
0016357dd00da19897ca,What are the Chinese fortune sticks meanings?,0
0016589b372f1c1eb903,How can I find out the carrier by only using the tracking number in the UK?,0
00165bc540db41eba85c,Why do I love starting fights and making people angry?,0
00166855d7ba34925882,Should I use my brain more?,0
00167522d319f8ac3dee,How does the electrostatic force f revolving electron becomes equal to the centripetal force?,0
001679926f03735b7ce6,How does bikini look like?,0
001686940e8792f83be6,What is a 1969 100 dollar worth?,0
001689a792974397f88f,Why did my clock stop at 3:00 in the morning?,0
00168b9938401250ca20,What is the difference between dimension table and fact table?,0
00168dfb206f15c9d227,How dangerous of an animal is a mandrill?,0
00168feb7d3492a0bea1,What are some ways for a layperson to profit from a country's currency failing?,0
0016974b878d96f4deba,How can certain pro-lifers call themselves that when they believe a woman should die than have an abortion to save her life?,0
0016a47c90ac0b658d6f,How is asking a data scientist to analyze the national economy different than asking an economist to analyze the same economy?,0
0016a66f5e7298df04d2,How can I get Bansal classes sheets?,0
0016b2263ebbe71b2d38,"Aren't religious people afraid that their deceased loved ones are watching them while they're using the bathroom, masturbating or having sex?",0
0016c4f69b19674b9946,How much weight can a toy wooden boat hold in kilograms?,0
0016c7456d44024392cf,Is there a way to report a business review of your business on Facebook? How do you do it?,0
0016f0a816a246aa9c98,Which models does the Chevrolet Caprice PPV primarily compete with? How do they compare?,0
0016f409865edd3db89b,What type of franchise can be thought of in a city like Surat (Gujarat) with a small investment?,0
0016fd702c244fbcbd1a,How do I score good marks in economic application for ICSE examinaton?,0
001704647213a21db886,How does radar guidance for anti-aircraft guns work?,0
00170d2bb5236246a76e,Why was a non-offensive photo without nudity or profanity deleted?,0
001711e6510babb51cb0,Why are Chik-Fil-A's restaurants always so nice compared to most other chains?,0
00171341f9bde0562046,Is there any way to get insurance of damaged two wheeler?,0
0017180f819753460c5c,What are my chances to grab an MBBS seat under 85% state quota in West Bengal with 437 marks in NEET 2017 in a government college?,0
00171cc1cc563babed09,What are some unique live/study abroad experiences that you have?,0
0017209fdc0cb5e057c3,"When he has to go somewhere or take or do something for his sister, he says I can go but when I do 5 min in the car ride he starts a fight and accuses me and says im ruining his day why?",0
001752a54bf15792603e,"What does curvature of space time mean. We know that there isn't a humongous net in space that is curved, so what is it?",0
00175f5e9c85b110614e,Why do Americans prefer just to not show up somewhere rather than face even the mildest of conflicts? (My colleagues and I have noted a growing number of people who skip any face to face meetings without any explanation at all.),1
00176456d6ddced07e7b,How harmful is electromagnetic interference?,0
00176686b72a7ab45980,How can I distinguish between relative scales such as B-flat major and G-minor or C major and A minor?,0
00176fb431dd99a30307,Do we feel our breath?,0
001786289fc5ec772799,What are the reasons for drug trafficking?,0
0017b4475be5b467a34d,What should the normal fetal heart rate be during pregnancy?,0
0017ba49f77d868ac26b,How can shoulder pads protect you in American football?,0
0017c2a0ca8e0154bc83,"My ex-girlfriend and I live in different countries, we are very much in love, and cannot be together for 3 more years. What should we do?",0
0017cee73ad61222e268,What are the similarities between communication and information?,0
0017d84388eecb97d6e3,Which company can I apply in web development domain having 2 years of experience in Cognizant?,0
0017e32a7bbad42e70a9,What happens if I drink 1 can of Monster Energy?,0
0017e916bb2937de4bee,Which is the biggest alphabet in the English dictionary?,0
0017f9c93f9a711d2d89,Who invented the modern portfolio theory?,0
00180060eb68cf37647a,Can we convert heat directly into elecric energy without a cold body?,0
001810cfacde0b098bf3,Is Finix Coin ICO legit or scam?,0
001816e8aa577caa1c29,"How good are my chances of getting accepted for PhD at MIT, Caltech, Berkeley? See comments for details.",0
0018393b368700fbeec0,Is 0.888… equal to 0.999… because of rounding?,0
0018464a32324de08696,Why is India actually called as India?,0
00184a76fb9768e5cfd3,What causes weevil infestations at your home?,0
00184eed4479d8626f91,Why does my boyfriend give me the silent treatment?,0
00188f39b8d814d9446c,What is the history of matrices in computer science?,0
0018a64f224b2322f79f,How do you stop making mistakes when playing chess?,0
0018b18b2554573bfd3d,What is the best step to work as a freelance writer?,0
0018b963fe232a853c8a,Why would you expect to have dilute urine with Addisons disease?,0
0018c2261c15cf6e745b,What is supercharging in IC engine?,0
0018d0484689b7601d8e,Does stiffness attracts load in beams?,0
0018eae4b1abdd7611d1,What are Somen well designed social experiments?,0
0018fca6740fdb664517,"If reincarnation is not true, why do some people remember their past lives?",0
00190455bad14053987d,Why super respectful and successful entrepreneurs who are millionaires or billionaires don't want to be lead in politics?,0
00190731e5d576d93154,Who is likely to be fluent in English: a Ghanaian or a nigerian?,0
0019242decef4a6b684a,Who is objectively the most powerful character in the Marvel/DC universes?,0
0019277e09e3f6072d13,"Why are all of the most popular comments on NYT are against the memo, whereas the ones on WSJ are pro-memo, given NYT and WSJ have similar political bias?",0
00192c62e8f2d71716ff,What does the diet of the mantis shrimp consists of?,0
001931e40f822e197ec9,"Is the term ""linguistic differential"" an actual linguistic term?",0
00193b23b7a2b81c10a2,"Why do so many people decide against Graph Databases? Scalability? Not enough experts? Mostly ""unconnected"" data to start with?",0
0019468bf049ceb43422,What is your opinion on chicken waffles?,0
00194aa2fea77afd7678,What is the best diet for teddy bear hamsters?,0
00194d6ec2f8fa6f08db,Have you ever taken your sweet time imagining a fiction book?,0
00195924fdb4e791e7a2,What is the scope in sound engineering in India and what is the annual income of sound engineers?,0
00196038adf72a1c024f,I just lost a tooth. Why can't I see my new tooth forming? It has been already 4 days.,0
001972a96c587dc56540,Is it possible for a human to think faster?,0
00197e786c9e3254cc81,Will it be helpful if I drop 1 year and appear for it again if my results this year are not good enough?,0
00199a473cba7b54d974,"Liberals are pro-choice, but the choices must be approved by them first. Is this an accurate description of liberals?",1
