qid,question_text,target
0026be59ba33680339fd,Is there any sense for native English person to immigrate to Germany from Great Britain?,0
0026d424a107ca74e1b8,Do FL police record any data when they check a citizen's ID without issuance of any citations or infractions?,0
0026e2f3aa8c1582eb46,Do electric cars have gears?,0
0026e44dddf6a376c423,"How do I live on 20,000 a year?",0
0026fe4ede065086039e,What is an impersonal God?,0
002706c108593d2aab3c,How can I avoid my dog from getting wet when it rains if I can't allow her to come inside and there is no dry area available for her to stay under?,0
002734a911eb1abc996d,What is the best way to deal with sex withdrawal?,0
00273ef277d580da66a1,Where's WeChat symbol?,0
00274b1df978f32ccd5e,"Where are the best colleges and why (e.g. free tuition, job opportunities?",0
00275c4a6b589afb34ec,What is the purpose of the siliceous ooze?,0
00275d2e2ad666096389,How do I sell Pakistan? I need lots of money so I decided to sell Pakistan any one wanna buy?,1
00277953a272386a4c6a,Where are the first 10 employees of Flipkart now?,0
0027844ba5e86d4b185d,"The solar system is not a fixed reference frame in the universe, so are we experiencing any time dilation effects due to its movement?",0
00278571328954ce971c,Would thin plated armour with folded leather scales underneath make a good knight's armor?,0
002786662bf15124c049,What are some unique bandeau outfits ideas for teenagers?,0
0027867169577a472974,What the simlarity between computer organization and computer arichtecture?,0
0027b475c77063a30031,What were the most important 5 causes of the Great Depression?,0
0027da8a024d22197a0d,Are you covered by insurance if you die on a roller coaster?,0
0027e606dd7851f96458,How did civic nationalism originate?,0
00280e0511a7202a08d8,What other big investment options with less risk are there in India except real estate?,0
0028116b4f03976eec60,What eventuality are you prepared to survive and would such a collapse be worth surviving?,0
002818285238dbc1cfe0,Why Can't People change Gender physically the way animals can?,0
00281ba728f6243ff7bc,"Why do my Gmail passwords keep disappearing? I'm on a Mac, and all my Gmail boxes are in the sidebar along the left. Every so often, I lose connection to my Gmail boxes, and have to reset all the passwords. I access these mail boxes every day.",0
00282941b43dd3b5724d,What do I need to do to become a great electrical engineer?,0
0028305145adcfebc5b2,Can weed cause cardiac arrest?,0
00283e652adf69e38c72,Are there any types of tooth-coloured fillings?,0
00284426d4737d6af5cf,"Why do I think it's good for a country to have more CCTV surveillance and phone surveillance despite ""human rights abuse claim""?",0
002845db5432b2545748,"How can I notify one of my tweeter contacts about the fact that his account is possibly hacked, since it likes pornographic content, is it possible to send an anonymous message?",0
00284bbdb60c6cdf373c,Choose your least favorite MCU villain. How would you improve him/her?,0
00284fc18b03c771c7ab,Why cant Indians stop comparing themselves with much developed countries and start working on building themselves instead?,1
0028665e184ea6f21093,"Between Armfeldt, Lewenhaupt and Rehnskiöld, who was the best Swedish general?",0
002873fdf551409d36ef,What do psychopaths think about the fat acceptance movement?,0
00287b28f4008d99d768,How do you know if a guy is just sweet and caring or has feelings for you?,0
00288badba20c465d33a,Have you ever cheated on someone's test in school?,0
002891af5753829e9cf0,Which companies in India hire SQL developers?,0
0028a18f4ff93eb89619,What was the most fun you have ever had in your life?,0
0028a1c04b9447f3be1c,What area is considered to be Western Europe?,0
0028a93a17bcd4c3925e,What is the best laptop for everyday use and some light gaming?,0
0028b45e4c89721cf239,Who are bigger the red blood cells or the white blood cells?,0
0028d58135f9c1b5ad8c,What is the significant of logarithm in image processing?,0
0028d91d0ba904ddb7c3,Which area in Banglore is safest for working women?,0
0028f67ccff988aee531,What is the meaning of nudge in hike?,0
0028fd9562805d42a16f,What is the most real thing or idea?,0
00290136e6ddf1846888,What's your penis size? Isn't that funny?,1
002913945566f6cae369,What is the relation between the rotation of earth and changing polarities?,0
00291b7116820990a72a,What is the difference between active duty and the coast guard?,0
00292a335f998311000c,How is Dynamic 365 team at Microsoft IDC Hyderabad?,0
00294e5623ad531ecea7,How do I keep my lazyness away?,0
00295ca6c3703de69220,Which posion can kill human in few mintues?,0
0029691ccc1cd5b4c0c5,How long does a stand-up count take in prison?,0
00296f75eb82f78682ad,Why is my dad unnecessarily harsh on me than when compared to my siblings (I am a first-born)?,0
0029912ec19eab703bc0,Are all anti-missile systems THAADs?,0
00299f37e322934b04d5,Can we have hybrid bike wheels on a mountain bike frame?,0
0029ad686abc23ada02e,How do I win over a married man?,0
0029ba83bc1b0e1094d0,What do you think of Donald Trump's new 'real news' program hosted by his daughter-in-law?,0
0029bbffb6dd7e4a4c86,How was Buddhism an improvement for women in Hindu cultures?,0
0029daf7b78a1a2439d8,What is the largest state in terms of population?,0
0029dbe0d816136e8381,What do liberals think the NRA is? Why do they protest the NRA and feel they are evil?,1
0029e12d6135e4fca53b,How do grown men look in skinny jeans?,0
0029e1a6081858c3d14a,What is the best site to learn basic computer?,0
0029e1a6d511f2993131,What is the background of the Hammer v. Dagenhart case?,0
0029f473270ea5143b41,Are there British actors who have lost their accents either completely or partially from living in America for so long?,0
002a1d04c77b1a0dd329,What would it take for US homeowners to begin putting solar panels on their roofs en masse?,0
002a2836b3db5aa211ec,How would I be able to record clips of TV shows and upload them on YouTube? What tool is best to use? And does anyone know how I could do it?,0
002a2a6d561b730142da,How can I treat a watery discharge after 39 weeks pregnant?,0
002a40f7d1b58ed0bfd0,Do most 11 year olds have bad mums and dads?,0
002a474cf60fda86eb04,Apparently cold showers are good for your skin and hair. How often should I take them? Once a day or twice a day?,0
002a55f78244a4d61adc,How likely is Facebook going bankruptcy?,0
002a5f773783badefe0a,What is the maximum size possible for a thunderstike?,0
002a621639f26e1b653d,What can be revealed throughout the genome of the platypus?,0
002a63a02c4cacb5c592,What do you think of the 100% renewable feasibility evaluation by LUT and EWG? Are there any major flaws in this study?,0
002a6ced017aa96f3d25,Do you really think you could follow through with taking a actual bullet for someone?,0
002a71861570990c291d,"If you inject within the marked areas on this rat, what would you risk penetrating?",0
002a7d20d3ef20111d21,If a venomous snake bites a human and that human is sick and that venom can cure that human but also harm it how would you go by proceeding that medical procedure?,0
002a843c7630b057e45a,Why is it important to amplify a signal before sending it to the recipient?,0
002a9dc409cc2520271e,What can we do for our society?,0
002aaadb57f1f81a3336,Why are the lifeguards necessary at any aquatic facility?,0
002aad678ac2c9ae35b1,Does the diameter of a bob affect the pendulum?,0
002ab0b9fab33f1775d8,What's the difference between multiplication and quantitative percentages?,0
002ab20672f84081804a,"If I delete my Quora account, can I use the same email address to create another one?",0
002ab863fc291e10c241,Is there an intuitive way to understand how Radon–Nikodym derivative is useful?,0
002ad113802bf65b479f,Is South Africa a safe country to visit?,0
002ad2ba6e5d4bc0240e,What is the best route from Houston to San Francisco if I have one week?,0
002aec988a02954bc80e,What is the structure of white blood cells'?,0
002b06352ea8a207eb36,Why can't we stop religious conversions in India?,0
002b06bdb7627105e270,I like to start a business or continue my dad's business. Should I do BBA or BBM?,0
002b20092b4c6c1d97cb,What is the fee for COMEDK MBBS 2017?,0
002b2a4e02f63951851c,What is the best motivation you've ever received?,0
002b43a78f69c768989a,My skin turns dark with any body lotion that I use. Why?,0
002b4d9dce81e0ce8dbd,Why does my mother call me her favorite when were alone but when we are around my other siblings she says she has no favorites?,0
002b4e57043e26ce61c3,What is the best way to tackle the situation where I am earning much more than my friends and they look at me with 'expectations'?,0
002b565ebf9608f3a2a2,Does “t” go silent in ‘it’ll”?,0
002b6ae0795fd7e68077,"Hypothetically, how effective would a mercury filled grenade be at killing enemy combatants?",0
002b7549d23d2a663e73,"Are the syllabic consonants of the Sanskrit varnamala {ऋ, ॠ, ऌ, ॡ} considered vowels or consonants?",0
002b9746d06b9bc4fe6f,Should I buy clothes or a phone?,0
002b9b8a9adec392454a,Which government medical college can get with 320 marks in NEET 2017 (SC Category)?,0
002baeeee2f4a2459ac5,What are the articles that come from a famous journals and their content is to compare tow things and the writing model or writing skill is worth learning?,0
002bb125dc621663ccc5,What would you do if you had total obedience over all living creatures for one day?,0
002bb2a53560cdd5ec64,How do I select the best dental practice marketing agency for dentists?,0
002bbe04773828983406,Who are the best professors at the University of Cambridge?,0
002be7ff290d37116ac4,Which is best Jaypee 62 or MIT Pune for CSE?,0
002bebc8b73c0f245930,What are some important chapters for NEET 2018 for biology?,0
002bfb2388ac2bc1e56e,Do we get foreign assignments in public relations?,0
002c02ccd1de5779c666,"If Britain revokes Article 50 now, would the value of the pound go up? If yes, by how much?",0
002c1e5b0eb68bf094cf,My Apple radio keeps surging whenever I turn on the radio. How can I fix it?,0
002c2fc7ac1e47a10ecc,Which field of work does India have the least members?,0
002c382f27f61338f30f,What parts of your job are fun?,0
002c4d82ad6ac30768ed,How does a business-major student incorporate an international dimension to his/her undergraduate education?,0
002c53697c04e32faaa5,How well would have Ike Ibeabuchi done in boxing if he didn't have his career damaged by legal issues?,0
002c5542df395acdfd15,Can somebody guide me about purchasing an exercise bike for home? What are some good models in the range of rs. 4000 to 7000 with features?,0
002c5ea23269c736c458,Why do people find pleasure in enemas?,0
002c8099319e6137d43a,Which football should I buy?,0
002c9ee245e7635e18cd,"What were General Walter Bedell ""Beetle"" Smith's major accomplishments?",0
002cc1be747e9ee652f9,Is Kenya safe foe residents?,0
002cc47606117ade757e,What are some good examples of suspension in chemistry?,0
002cc55c2a3d3c8687fc,How profitable is the car leasing business post GST?,0
002cca0ba3c0ac801c09,What are the best plants for increasing indoor air quality that are easily maintanable?,0
002ccae3aaff8ceb36cf,What is the biggest fear of newly retired people?,0
002cdfcc3c178ed42dc5,Can we move outside after midnight in Kota just to swing our mood?,0
002ce185cf563db59f97,Which presidents since Kennedy has committed the most crimes?,0
002ce8dcc009e9cf977a,Why do people in Beijing put a traffic cone next to their parked car?,0
002ceaa7676d193ee892,What is the experience of an Indian-American going to India for medical school?,0
002cfeb83edd0a47785b,Does it make sense for a container component to render several presentation components?,0
002cff96645f9872df6d,Why does Ronaldinho looks like a girl?,0
002d05491a0e558a0d15,What companies sell non-branded high quality smart casual clothes?,0
002d0d901b7b43f509a8,Who is the present education minister of Karnataka?,0
002d2d8792d0f1cc78e3,"In videos of North Korean military parades, they march with what appears to be a very exaggerated goose step. Is this their normal marching step?",0
002d403c990fbf97ca55,Who are often unsuccessful to catch their prey?,0
002d5fb6a34bcaf6ec57,How soon after WWII was a right-wing political party founded in Germany?,0
002d7b3a148fcd42a7c4,"My boss watched porn on his work computer, how can I get him to stop?",0
002d9b516ded0aa4f077,What is mostly imortant in being a doctor?,0
002d9f5bbca6ad1a681a,How tall do your parents have to be for you to become 6 feet?,0
002da217f3dca3980a22,What steps I should be taking if I am having an idea about a product that can solve the problem that sportsmen face?,0
002db12ea20bbd373044,What are the most effective strategies that startups are using to reach out to target audience other than paid ads and blogs?,0
002ddc5109b475780e6e,"If the devil really exists, what is currently working on?",0
002e17ccf847c10a54ac,"Why does my grandmother call wrestling ""wrastling""?",0
002e18f620ff218a8fe3,Why do I have sudden intrusive thoughts about being in pain?,0
002e59231342d69c0fcc,What are some good and unique crochet scarf patterns?,0
002e5b8a6ea8b35624c3,Is Brian Griffin a good role model on Family Guy?,0
002e5e509a6d4daa9576,"Frequently, part of my legs starts getting very itchy for no apparent reason and usually there will be an isolated hive/bump or a heat-rash-like condition. Does anyone know what causes this?",0
002e63e4739922bed856,What is difference between a gene and a allele?,0
002e7fa4cf296b1fbdf8,What are the uses of face oil? Which face oil is good for dry skin (I have extremely dry skin)?,0
002ebf1deece74df856a,What are cons of surface mining?,0
002ec6a4ac4d6470d9a4,What are some great places according to you to travel solo?,0
002ecb825db10a1e92e7,What pleasure is there in keeping snakes as pets?,0
002ee349bd33864f52aa,Can you get sick from old water?,0
002efb165aa535bb5b8f,Has it ever happened that you lost your faith and belief in God?,0
002efc55573609a33209,How do I find out the password for my Elite paycheck plus debit card if I haven’t set one up?,0
002f01e846eb9fa26cfe,What are my chances at 1370 MP state rank in NEET?,0
002f0c459fa13a26d6a2,What are your favourite before and after sentences?,0
002f1fa8eea6dc7aa5eb,"Since Sasuke and Naruto are the reincarnation of Indra and Ashura, are they brothers?",0
002f24706466f4a0b79a,Can I do genetic engineering after doing chemical engineering?,0
002f259ada6155f2749d,"Why is it that the phrase 'the dead of night' makes sense, but 'the alive of day' doesn't?",0
002f4175edfbb9228462,What are the job opportunities after doing MA (economics)?,0
002f49bb671828d9e7b8,Which player had the greatest performance in Super Bowl 2018?,0
002f647f87e8f4c349de,What is something that never needs to be said?,0
002f82e9aea808c4c6c2,What is wrong with BJP in Punjab?,0
002fac6e44e4b3506921,Shouldnt there be more women in IPS?,0
002fb3253a823ca86641,Could the president sign an executive order banning the NRA from making campaign contributions at any level?,1
002fc06bb7239bc51430,"Where can I find abandoned places in Campania, Italy?",0
002fc471687484289521,How does Lyft track who I am after deleting and reinstalling their app?,0
002fcf75d13df8ed45e5,Would you die to save your loved one?,0
002feef1371addbc1392,Did you by any chance go to a naval school?,0
002ff88666fb2cc4fb61,How many agni 5 missiles do India have?,0
002ffebf02534b00b670,Are Mughals descendants of Genghis Khan?,0
0030232e168bdfeff811,What is the best city you have ever visited in Turkey?,0
00303207fcb396ce6840,What are the best lifehacks for hairs?,0
00305d75b92df295e986,"Will America's current ""civil war"" go hot and if so how will it go?",0
0030741fda121933b82b,How can I improve my high kick technique?,0
00307c36b0c9debaf715,What are the functions of amylose?,0
003080e4f4063c82a2e8,How much does it cost to build a professional basketball half-court in France?,0
003088e3b398a801f221,What will happen to Bitcoin when power goes out for weeks across the world from a CME?,0
00309392719aee62ec39,Are motorcycles in Toronto highways exempt from the speed limit?,0
003095e45e5474919dc2,How can I learn making a stop motion whiteboard video (like the video in the link) and does it take so much time to make one?,0
0030a7853565d57c4450,"Today, my friend came up to me at lunch and said “this morning I started my period and I have cramps”. I just went “um I didn’t ask…”. She said that it was weird that I was uncomfortable when she told me. Was my response the correct one to give?",0
0030d3e3fbef52753ac7,What are the parts of a nucleus?,0
0031019f0dd75b0d1ddb,"A new software developer insisted to use kubernetes for a backend project where no developers in the company have experience in Docker and Kubernetes, as the CTO, what should I do?",0
0031052210a35f3d7bcc,Dating is boring for me. Am I the only one?,0
00310a0b32e57e23b716,How was early Christianity practiced diffferently than today?,0
003117da7a5c13ac1e70,Why is my stream pixelated and choppy?,0
003124297ed5210ccd38,What would have happened if Indian subcontinent had stayed together?,0
00313fa73b480db2f5aa,"How do I make a girlfriend in Bangalore? I work in IT, have sufficient money, and I am good looking. And No girls at workplace.",0
003159153e176da7d3f7,"What are the personal benefits of giving to charity, other than tax breaks?",0
0031781e410a9bc36802,Is there any organisation/club in Pune which helps to appear for the Ham radio licencing (ASOC) examination?,0
003179957f5810266dde,Why Chinese people are always not welcome in all countries?,1
00317dbdbcc7414b6942,Why do clouds look solid from the ground?,0
003188056b38bd50d5e0,Is Frieza a man or a woman?,0
